272,even the wrath of messi neymar and suarez combined cannot surpass the wrath of heat mosquitoes and dumsor combined,anger,negative,,,,,,,,,,,,
356, when your stew dey spoil seek of dumsor gtgtgt this is an option ,anger,negative,,,,,,,,,,,Unknown Polarities,
391, when your stew dey spoil seek of dumsor gtgtgt this is an option ,anger,negative,,,,,,,,,,,,
392, when your stew dey spoil seek of dumsor gtgtgt this is an option ,anger,negative,,,,,,Anger ,66,,,,Negative,429
393, when your stew dey spoil seek of dumsor gtgtgt this is an option ,anger,negative,,,,,,Disgust,10,,,,Positive,1118
394, when your stew dey spoil seek of dumsor gtgtgt this is an option ,anger,negative,,,,,,Fear ,18,,,,Neutral,94
396, when your stew dey spoil seek of dumsor gtgtgt this is an option ,anger,negative,,,,,,sadness,87,,,,,
397, when your stew dey spoil seek of dumsor gtgtgt this is an option ,anger,negative,,,,,,surprise,8,,,,,
398, when your stew dey spoil seek of dumsor gtgtgt this is an option ,anger,negative,,,,,,joy,167,,,,,
631,hate the dumsor in gh i need power bank,anger,negative,,,,,,unknown,1641,,,,,
637, looks like you had mad fun besides the dumsor i guess you survived hehe,anger,negative,,,,,,,,,,,,
639, looks like you had mad fun besides the dumsor i guess you survived hehe,anger,negative,,,,,,,,,,,,
833,ah  but did  you diert kofieric yo  the dumsor in the last week has returned with more vim cont h,anger,negative,,,,,,,,,,,,
835,but did  you die yo  the dumsor in the last week has returned with more vim cont ,anger,negative,,,,,,,,,,,,
1060,oware and ludo making a serious comeback thanks to dumsor as a s kid im not too mad at that,anger,negative,,,,,,,,,,,,
1061, i just realised because of dumsor the stew has gone bad and i came home super hungry …,anger,negative,,,,,,,,,,,,
1090," why i hate kumasi
dumsor is major
no ozone layer 
kumasi   ",anger,negative,,,,,,,,,,,,
1137," why i hate kumasi
dumsor is major
no ozone layer 
kumasi   ",anger,negative,,,,,,,,,,,,
1138,"why i hate kumasi
dumsor is major
no ozone layer 
kumasi   ",anger,negative,,,,,,,,,,,,
1145,this is wat makes this whole dumsor tin annoying ur lights going off at unexpected times,anger,negative,,,,,,,,,,,,
1340, i just realised because of dumsor the stew has gone bad and i came home super hungry ,anger,negative,,,,,,,,,,,,
1419, i just realised because of dumsor the stew has gone bad and i came home super hungry  eat up,anger,negative,,,,,,,,,,,,
1420, i just realised because of dumsor the stew has gone bad and i came home super hungry …,anger,negative,,,,,,,,,,,,
1421, i just realised because of dumsor the stew has gone bad and i came home super hungry ,anger,negative,,,,,,,,,,,,
1422,i just realised because of dumsor the stew has gone bad and i came home super hungry ,anger,negative,,,,,,,,,,,,
1424,   check my dumsor timetable id have light on sunday dont worry bro am covered,anger,negative,,,,,,,,,,,,
1440,off to bed after this idiotic dumsor anthemanyway my agenda for tomorrow is the blues big game coming up against ,anger,negative,,,,,,,,,,,,
1781,   oh medier mmai cant u send a text to dat effect instead of that dumsor internet am so mad,anger,negative,,,,,,,,,,,,
148," even china no fit do this shit 

“ the best way to fight against dumsorwith a smart phone<U+653C><U+3E64><U+613C><U+3E30><U+623C><U+3E64><U+653C><U+3E64><U+623C><U+3E38><U+383C><U+3E32><U+653C><U+3E64><U+613C><U+3E30><U+623C><U+3E64><U+653C><U+3E64><U+623C><U+3E38><U+383C><U+3E32><U+653C><U+3E64><U+613C><U+3E30><U+623C><U+3E64><U+653C><U+3E64><U+623C><U+3E38><U+383C><U+3E32> …",anger,neutral,,,,,,,,,,,,
149,"even china no fit do this shit 

“ the best way to fight against dumsorwith a smart phone<U+653C><U+3E64><U+613C><U+3E30><U+623C><U+3E64><U+653C><U+3E64><U+623C><U+3E38><U+383C><U+3E32><U+653C><U+3E64><U+613C><U+3E30><U+623C><U+3E64><U+653C><U+3E64><U+623C><U+3E38><U+383C><U+3E32><U+653C><U+3E64><U+613C><U+3E30><U+623C><U+3E64><U+653C><U+3E64><U+623C><U+3E38><U+383C><U+3E32> ”",anger,neutral,,,,,,,,,,,,
518,i would do a lot for some air conditioning right about now but dumsor more the dum than the sor,anger,neutral,,,,,,,,,,,,
526,guess im suffering this dumsor thing the most in the whole of ghana sleeps and wakes up in a bed full of sweat like its a pool ffs,anger,neutral,,,,,,,,,,,,
701,the high or low rates of the dollar and most likely ghana’s famous dumsor must have been the factor constituting ,anger,neutral,,,,,,,,,,,,
1129,feeling the dumsor live from arlington tx ive always shared in the frustration of my people but hands on really means hands on tornado,anger,neutral,,,,,,,,,,,,
1520,ppl aint complaining much abt dumsor these days im pissed cos it hasnt reduced just seems like a lot of us have got use to it <U+653C><U+3E64><U+613C><U+3E30><U+623C><U+3E64><U+653C><U+3E64><U+623C><U+3E38><U+613C><U+3E35><U+653C><U+3E64><U+613C><U+3E30><U+623C><U+3E64><U+653C><U+3E64><U+623C><U+3E38><U+613C><U+3E35>,anger,neutral,,,,,,,,,,,,
67,dumsor endangers exams at presec  students of the presbyterian boys senior high school presec here in ,anger,positive,,,,,,,,,,,,
351,fame – “rebel leader” following closely the release of their previous single mi ma mo dumsor featuring con ,anger,positive,,,,,,,,,,,,
354,fame – “rebel leader” following closely the release of their previous single mi ma mo dumsor featuring con ,anger,positive,,,,,,,,,,,,
355,fame – “rebel leader” following closely the release of their previous single mi ma mo dumsor featuring con ,anger,positive,,,,,,,,,,,,
359,fame – “rebel leader” following closely the release of their previous single mi ma mo dumsor featuring con ,anger,positive,,,,,,,,,,,,
360,fame – “rebel leader” following closely the release of their previous single mi ma mo dumsor featuring con ,anger,positive,,,,,,,,,,,,
361,fame – “rebel leader” following closely the release of their previous single mi ma mo dumsor featuring con ,anger,positive,,,,,,,,,,,,
362,fame – “rebel leader” following closely the release of their previous single mi ma mo dumsor featuring con ,anger,positive,,,,,,,,,,,,
363,fame – “rebel leader” following closely the release of their previous single mi ma mo dumsor featuring con ,anger,positive,,,,,,,,,,,,
365,fame – “rebel leader” following closely the release of their previous single mi ma mo dumsor featuring con ,anger,positive,,,,,,,,,,,,
368,fame – “rebel leader” following closely the release of their previous single mi ma mo dumsor featuring con ,anger,positive,,,,,,,,,,,,
369,fame – “rebel leader” following closely the release of their previous single mi ma mo dumsor featuring con ,anger,positive,,,,,,,,,,,,
370,fame – “rebel leader” following closely the release of their previous single mi ma mo dumsor featuring con ,anger,positive,,,,,,,,,,,,
371,fame – “rebel leader” following closely the release of their previous single mi ma mo dumsor featuring con ,anger,positive,,,,,,,,,,,,
373,fame – “rebel leader” following closely the release of their previous single mi ma mo dumsor featuring con ,anger,positive,,,,,,,,,,,,
374,fame – “rebel leader” following closely the release of their previous single mi ma mo dumsor featuring con ,anger,positive,,,,,,,,,,,,
375,fame – “rebel leader” following closely the release of their previous single mi ma mo dumsor featuring con ,anger,positive,,,,,,,,,,,,
376,fame – “rebel leader” following closely the release of their previous single mi ma mo dumsor featuring con ,anger,positive,,,,,,,,,,,,
377,fame – “rebel leader” following closely the release of their previous single mi ma mo dumsor featuring con ,anger,positive,,,,,,,,,,,,
378,fame – “rebel leader” following closely the release of their previous single mi ma mo dumsor featuring con ,anger,positive,,,,,,,,,,,,
379,fame – “rebel leader” following closely the release of their previous single mi ma mo dumsor featuring con ,anger,positive,,,,,,,,,,,,
380,fame – “rebel leader” following closely the release of their previous single mi ma mo dumsor featuring con ,anger,positive,,,,,,,,,,,,
381,fame – “rebel leader” following closely the release of their previous single mi ma mo dumsor featuring con ,anger,positive,,,,,,,,,,,,
382,fame – “rebel leader” following closely the release of their previous single mi ma mo dumsor featuring con ,anger,positive,,,,,,,,,,,,
383,fame – “rebel leader” following closely the release of their previous single mi ma mo dumsor featuring con ,anger,positive,,,,,,,,,,,,
384,fame – “rebel leader” following closely the release of their previous single mi ma mo dumsor featuring con ,anger,positive,,,,,,,,,,,,
385,fame – “rebel leader” following closely the release of their previous single mi ma mo dumsor featuring con ,anger,positive,,,,,,,,,,,,
511,dumsor endangers exams at presec  students of the presbyterian boys senior high school presec here in ,anger,positive,,,,,,,,,,,,
765, headmasters in some high schools begin to charge students for generators dumsor effect on education ubs  …,anger,positive,,,,,,,,,,,,
1661,dumsor endangers exams at presec  students of the presbyterian boys senior high school presec here in ,anger,positive,,,,,,,,,,,,
1818," some of us missed  interview with 
therealbolaray bcos of dumsor
u fit upload the audio for us",anger,positive,,,,,,,,,,,,
576, i miss dumsor ecg  i beg show me something its been a while lol”almost there about to turn it off…,disgust,negative,,,,,,,,,,,,
580,“ i miss dumsor ecg  i beg show me something its been a while lol”almost there about to turn it off bham,disgust,negative,,,,,,,,,,,,
595, watch for ma single title dumsor ft samini   lol he go be sick tune pure ragga sane lol cant wait,disgust,negative,,,,,,,,,,,,
596, watch for ma single title dumsor ft samini   lol he go be sick tune pure ragga sane,disgust,negative,,,,,,,,,,,,
600,watch for ma single title dumsor ft samini   lol he go be sick tune pure ragga sane,disgust,negative,,,,,,,,,,,,
1708,too tired to jerk off in this dumsor after work goddamn,disgust,negative,,,,,,,,,,,,
262,"dumsor based 
ecg just turn ma hand into a windmill",disgust,positive,,,,,,,,,,,,
485,coco cola can lay off workers cos of dumsor but still have mill for a turn up promotion well logically im a marketer so ,disgust,positive,,,,,,,,,,,,
1441,"et mensah cover  ghana  land of freedom    ghana free from dumsor x    now it has reach the turn of unemployment  x",disgust,positive,,,,,,,,,,,,
1442,"gh free from dumsorah well if so i think it has reach the turn of unemployment in the nation hehe bhim nation p",disgust,positive,,,,,,,,,,,,
,text,emotion,polarity,,,,,,,,,,,,
79,the dumsor is currently terrible on legon campus it is affecting lectures and all ecgwhy bringbackourlights  ,fear,negative,,,,,,,,,,,,
180,i got myself a dumsor phone wif  batteries so i dont fear ecg <U+653C><U+3E64><U+613C><U+3E30><U+623C><U+3E64><U+653C><U+3E64><U+623C><U+3E38><U+383C><U+3E32><U+653C><U+3E64><U+613C><U+3E30><U+623C><U+3E64><U+653C><U+3E64><U+623C><U+3E38><U+383C><U+3E32><U+653C><U+3E64><U+613C><U+3E30><U+623C><U+3E64><U+653C><U+3E64><U+623C><U+3E38><U+383C><U+3E32> ,fear,negative,,,,,,,,,,,,
184,dumsor what fear keeps you up at night wishmewell,fear,negative,,,,,,,,,,,,
338,when at all will dis dumsor end koraa gosh wat a hell has our lovely motherland turned into shata ,fear,negative,,,,,,,,,,,,
531,dis heat is too muchdumsor,fear,negative,,,,,,,,,,,,
597,lol “ tot dis dumsor had ended”,fear,negative,,,,,,,,,,,,
604,tot dis dumsor had ended,fear,negative,,,,,,,,,,,,
623,im scared of starting this project cos i dont wanna code halfway and dumsor emerges,fear,negative,,,,,,,,,,,,
671, which one too dis ebi network dumsor dumsor u guys details bore waaaadem dey bore ruff,fear,negative,,,,,,,,,,,,
913, dis black african man hot no biz going into no damm sauna trust me  dumsor na junior sauna no told the wife but s… h…,fear,negative,,,,,,,,,,,,
915,dis black african man hot no biz going into no damm sauna trust me  dumsor na junior sauna no told the wife but s… ,fear,negative,,,,,,,,,,,,
1071,am so traumatized by dumsor to the xtent dat am scared ecg may take lyts in my lightsoup ,fear,negative,,,,,,,,,,,,
1740,dumsor oo just bored here  lol  wat yu chop dis evening sake of ur tweets dieerr abeg ooo hehe,fear,negative,,,,,,,,,,,,
386,"dumsor dumsor dumsor
they told it will be better very soon but every week it is terrible again now new ",fear,neutral,,,,,,,,,,,,
676, u do an award show from pm to am amp u expect dumsor to be over see the chaw lights on stage sef ecg bennya mmo vgmas,fear,neutral,,,,,,,,,,,,
62,just my entire dinner in darkness without missing my mouth i think im finally getting the hang of this dumsor thing,fear,positive,,,,,,,,,,,,
1518, nice even better is when she chill  heineken energy drink add am before dumsor time bliss<U+653C><U+3E64><U+613C><U+3E30><U+623C><U+3E64><U+653C><U+3E64><U+623C><U+3E38><U+383C><U+3E64><U+653C><U+3E64><U+613C><U+3E30><U+623C><U+3E64><U+653C><U+3E64><U+623C><U+3E38><U+613C><U+3E63>,fear,positive,,,,,,,,,,,,
1531, nice even better is when she chill  heineken energy drink add am before dumsor time bliss<U+653C><U+3E64><U+613C><U+3E30><U+623C><U+3E64><U+653C><U+3E64><U+623C><U+3E38><U+383C><U+3E64><U+653C><U+3E64><U+613C><U+3E30><U+623C><U+3E64><U+653C><U+3E64><U+623C><U+3E38><U+613C><U+3E63>,fear,positive,,,,,,,,,,,,
275,dumsor got pent smelling like sweat and smoke,joy,negative,,,,,,,,,,,,
287, it is good to see that u too have been infected with the ghanaian ways of doing things i refuse dumsor lets get real,joy,negative,,,,,,,,,,,,
300, thanks to the ereaders short charge time and long battery life dumsor hasnt been a problem for the progra…,joy,negative,,,,,,,,,,,,
390, thanks to the ereaders short charge time and long battery life dumsor hasnt been a problem for the program,joy,negative,,,,,,,,,,,,
475,why should ghanaians worry about dumsor in south africa fix the damn problem for us and stop the …,joy,negative,,,,,,,,,,,,
609,"start giving complements to dah nigha jdm and ull regret haha iyh i laughed dumsor is back with a big bang itsbigitsbettter",joy,negative,,,,,,,,,,,,
641,if i no charge dumsor go gimme boring night,joy,negative,,,,,,,,,,,,
652,looks like our pressing issues as a nation are beyond just dumsor,joy,negative,,,,,,,,,,,,
717, anticipation of dumsor is worse than dumsor itself <U+653C><U+3E64><U+613C><U+3E30><U+623C><U+3E64><U+653C><U+3E64><U+623C><U+3E38><U+383C><U+3E32> <U+653C><U+3E64><U+613C><U+3E30><U+623C><U+3E64><U+653C><U+3E64><U+623C><U+3E38><U+383C><U+3E32> <U+653C><U+3E64><U+613C><U+3E30><U+623C><U+3E64><U+653C><U+3E64><U+623C><U+3E38><U+383C><U+3E32>,joy,negative,,,,,,,,,,,,
718, anticipation of dumsor is worse than dumsor itself <U+653C><U+3E64><U+613C><U+3E30><U+623C><U+3E64><U+653C><U+3E64><U+623C><U+3E38><U+383C><U+3E32> <U+653C><U+3E64><U+613C><U+3E30><U+623C><U+3E64><U+653C><U+3E64><U+623C><U+3E38><U+383C><U+3E32> <U+653C><U+3E64><U+613C><U+3E30><U+623C><U+3E64><U+653C><U+3E64><U+623C><U+3E38><U+383C><U+3E32>,joy,negative,,,,,,,,,,,,
719, anticipation of dumsor is worse than dumsor itself <U+653C><U+3E64><U+613C><U+3E30><U+623C><U+3E64><U+653C><U+3E64><U+623C><U+3E38><U+383C><U+3E32> <U+653C><U+3E64><U+613C><U+3E30><U+623C><U+3E64><U+653C><U+3E64><U+623C><U+3E38><U+383C><U+3E32> <U+653C><U+3E64><U+613C><U+3E30><U+623C><U+3E64><U+653C><U+3E64><U+623C><U+3E38><U+383C><U+3E32>,joy,negative,,,,,,,,,,,,
757,ghanaians prefer to die outside than to return to dumsor nation saynotoxenophobia,joy,negative,,,,,,,,,,,,
920, dumsor weak me i no dey get some pop but i dey see the the race heat waa,joy,negative,,,,,,,,,,,,
1041,deficit of ideas in solving problems like dumsor coupled with the mismanagement of the economy and a lack of ,joy,negative,,,,,,,,,,,,
1174," boss  be like we get too moch light new dumsor timetable go need
 a c c r a g h a n a …",joy,negative,,,,,,,,,,,,
1176," boss  be like we get too moch light new dumsor timetable go need
 a c c r a g h a n a …",joy,negative,,,,,,,,,,,,
1178," boss  be like we get too moch light new dumsor timetable go need
 a c c r a g h a n a …",joy,negative,,,,,,,,,,,,
1231, simply cos he had no faithchose to take the life than the cause of anotherperhaps there cud be dumsor or doctors on strike,joy,negative,,,,,,,,,,,,
1379,worst sleep ive had in years mosquitoes and dumsor dont make a good combination<U+653C><U+3E64><U+613C><U+3E30><U+623C><U+3E64><U+653C><U+3E64><U+623C><U+3E38><U+393C><U+3E65><U+653C><U+3E64><U+613C><U+3E30><U+623C><U+3E64><U+653C><U+3E64><U+623C><U+3E38><U+393C><U+3E65><U+653C><U+3E64><U+613C><U+3E30><U+623C><U+3E64><U+653C><U+3E64><U+623C><U+3E38><U+393C><U+3E65><U+653C><U+3E64><U+613C><U+3E30><U+623C><U+3E64><U+653C><U+3E64><U+623C><U+3E38><U+393C><U+3E65><U+653C><U+3E64><U+613C><U+3E30><U+623C><U+3E64><U+653C><U+3E64><U+623C><U+3E38><U+393C><U+3E65><U+653C><U+3E64><U+613C><U+3E30><U+623C><U+3E64><U+653C><U+3E64><U+623C><U+3E38><U+393C><U+3E65>,joy,negative,,,,,,,,,,,,
1429, cant catch my favourite ksm show all because of dumsor hey but no fears wuld watch the repeat show sund…,joy,negative,,,,,,,,,,,,
1432, cant catch my favourite ksm show all because of dumsor hey but no fears wuld watch the repeat show sunday afternoon at pm,joy,negative,,,,,,,,,,,,
1482, we can be ambassadors when the economy is good without dumsor so the call is a bit premature  lets revisit in ,joy,negative,,,,,,,,,,,,
1483," boss  be like we get too moch light new dumsor timetable go need
 a c c r a g h a n a …",joy,negative,,,,,,,,,,,,
1504,good job newly wed expectant father dumsor police no pick im more sick  i can only imagine e dey pain me sef,joy,negative,,,,,,,,,,,,
1509," boss  be like we get too moch light new dumsor timetable go need
 a c c r a g h a n a …",joy,negative,,,,,,,,,,,,
1516," boss  be like we get too moch light new dumsor timetable go need
 a c c r a g h a n a …",joy,negative,,,,,,,,,,,,
1517," boss  be like we get too moch light new dumsor timetable go need
 a c c r a g h a n a …",joy,negative,,,,,,,,,,,,
1560,the ghana employers’ associations has confirmed that close to  workers have been sacked in the last four ,joy,negative,,,,,,,,,,,,
1775,tnks  dumsor i ve  walk  a restaurant anytym am in town jux to charge my fon its nt lyk am fytin  wifi bt electricitywat a shame gh,joy,negative,,,,,,,,,,,,
1918,the ghana employers’ associations has confirmed that close to  workers have been sacked in the last four ,joy,negative,,,,,,,,,,,,
1944," boss  be like we get too moch light new dumsor timetable go need
 a c c r a g h a n a …",joy,negative,,,,,,,,,,,,
32,enaaa eeerh i dey verse selfwatin dey worry ona self y ona no wan make we enjoy dis light self dumsor,joy,neutral,,,,,,,,,,,,
45, sake of dumsor wont get access to ur interactive studio analysispls when can i catch d repeat,joy,neutral,,,,,,,,,,,,
161, you must visit our diy section for your own good youll find our dumsor survival kit n more u noe u need it  http…,joy,neutral,,,,,,,,,,,,
167, you must visit our diy section for your own good youll find our dumsor survival kit n more u noe u need it  http…,joy,neutral,,,,,,,,,,,,
172,you must visit our diy section for your own good youll find our dumsor survival kit n more u noe u need it  ,joy,neutral,,,,,,,,,,,,
216,good morning ghana and mr president how are u do today hope u feel great plss still continue to work hard n solve de dumsor problem,joy,neutral,,,,,,,,,,,,
421,live fm cos the dumsor kill everything,joy,neutral,,,,,,,,,,,,
578, the way he unfollows and follows me its like dumsor dumsor wanlovforprez,joy,neutral,,,,,,,,,,,,
579,"well in other news
because of dumsor a friend of mine is going to be a mommy soon
tragic",joy,neutral,,,,,,,,,,,,
618, ok so the on and off dumsor is kinda confusing to me <U+653C><U+3E64><U+613C><U+3E30><U+623C><U+3E64><U+653C><U+3E64><U+623C><U+3E38><U+613C><U+3E39> why u play with my happiness like that ecg <U+653C><U+3E64><U+613C><U+3E30><U+623C><U+3E64><U+653C><U+3E64><U+623C><U+3E38><U+393C><U+3E33> dumsor accra gh…,joy,neutral,,,,,,,,,,,,
622,ok so the on and off dumsor is kinda confusing to me <U+653C><U+3E64><U+613C><U+3E30><U+623C><U+3E64><U+653C><U+3E64><U+623C><U+3E38><U+613C><U+3E39> why u play with my happiness like that ecg <U+653C><U+3E64><U+613C><U+3E30><U+623C><U+3E64><U+653C><U+3E64><U+623C><U+3E38><U+393C><U+3E33> dumsor accra ghana pleasefix,joy,neutral,,,,,,,,,,,,
688, back to gh back to dumsor amp the stress but also back to the people i love oh and this fufu joint  <U+653C><U+3E64><U+613C><U+3E30><U+623C><U+3E64><U+653C><U+3E64><U+623C><U+3E38><U+393C><U+3E63> …,joy,neutral,,,,,,,,,,,,
715, oh yes dumsor is play a bug negative role  but i believe  projects like this come with their independent power projects,joy,neutral,,,,,,,,,,,,
729, back to gh back to dumsor amp the stress but also back to the people i love oh and this fufu joint  <U+653C><U+3E64><U+613C><U+3E30><U+623C><U+3E64><U+653C><U+3E64><U+623C><U+3E38><U+393C><U+3E63> …,joy,neutral,,,,,,,,,,,,
808, back to gh back to dumsor amp the stress but also back to the people i love oh and this fufu joint  <U+653C><U+3E64><U+613C><U+3E30><U+623C><U+3E64><U+653C><U+3E64><U+623C><U+3E38><U+393C><U+3E63> …,joy,neutral,,,,,,,,,,,,
824, back to gh back to dumsor amp the stress but also back to the people i love oh and this fufu joint  <U+653C><U+3E64><U+613C><U+3E30><U+623C><U+3E64><U+653C><U+3E64><U+623C><U+3E38><U+393C><U+3E63> …,joy,neutral,,,,,,,,,,,,
837, back to gh back to dumsor amp the stress but also back to the people i love oh and this fufu joint  <U+653C><U+3E64><U+613C><U+3E30><U+623C><U+3E64><U+653C><U+3E64><U+623C><U+3E38><U+393C><U+3E63> …,joy,neutral,,,,,,,,,,,,
842, back to gh back to dumsor amp the stress but also back to the people i love oh and this fufu joint  <U+653C><U+3E64><U+613C><U+3E30><U+623C><U+3E64><U+653C><U+3E64><U+623C><U+3E38><U+393C><U+3E63> …,joy,neutral,,,,,,,,,,,,
843, back to gh back to dumsor amp the stress but also back to the people i love oh and this fufu joint  <U+653C><U+3E64><U+613C><U+3E30><U+623C><U+3E64><U+653C><U+3E64><U+623C><U+3E38><U+393C><U+3E63> …,joy,neutral,,,,,,,,,,,,
847, back to gh back to dumsor amp the stress but also back to the people i love oh and this fufu joint  <U+653C><U+3E64><U+613C><U+3E30><U+623C><U+3E64><U+653C><U+3E64><U+623C><U+3E38><U+393C><U+3E63> …,joy,neutral,,,,,,,,,,,,
848, back to gh back to dumsor amp the stress but also back to the people i love oh and this fufu joint  <U+653C><U+3E64><U+613C><U+3E30><U+623C><U+3E64><U+653C><U+3E64><U+623C><U+3E38><U+393C><U+3E63> …,joy,neutral,,,,,,,,,,,,
849, back to gh back to dumsor amp the stress but also back to the people i love oh and this fufu joint  <U+653C><U+3E64><U+613C><U+3E30><U+623C><U+3E64><U+653C><U+3E64><U+623C><U+3E38><U+393C><U+3E63> …,joy,neutral,,,,,,,,,,,,
850, back to gh back to dumsor amp the stress but also back to the people i love oh and this fufu joint  <U+653C><U+3E64><U+613C><U+3E30><U+623C><U+3E64><U+653C><U+3E64><U+623C><U+3E38><U+393C><U+3E63> …,joy,neutral,,,,,,,,,,,,
851, back to gh back to dumsor amp the stress but also back to the people i love oh and this fufu joint  <U+653C><U+3E64><U+613C><U+3E30><U+623C><U+3E64><U+653C><U+3E64><U+623C><U+3E38><U+393C><U+3E63> …,joy,neutral,,,,,,,,,,,,
852, back to gh back to dumsor amp the stress but also back to the people i love oh and this fufu joint  <U+653C><U+3E64><U+613C><U+3E30><U+623C><U+3E64><U+653C><U+3E64><U+623C><U+3E38><U+393C><U+3E63> …,joy,neutral,,,,,,,,,,,,
853, back to gh back to dumsor amp the stress but also back to the people i love oh and this fufu joint  <U+653C><U+3E64><U+613C><U+3E30><U+623C><U+3E64><U+653C><U+3E64><U+623C><U+3E38><U+393C><U+3E63> …,joy,neutral,,,,,,,,,,,,
854, back to gh back to dumsor amp the stress but also back to the people i love oh and this fufu joint  <U+653C><U+3E64><U+613C><U+3E30><U+623C><U+3E64><U+653C><U+3E64><U+623C><U+3E38><U+393C><U+3E63> …,joy,neutral,,,,,,,,,,,,
855, back to gh back to dumsor amp the stress but also back to the people i love oh and this fufu joint  <U+653C><U+3E64><U+613C><U+3E30><U+623C><U+3E64><U+653C><U+3E64><U+623C><U+3E38><U+393C><U+3E63> …,joy,neutral,,,,,,,,,,,,
856,back to gh back to dumsor amp the stress but also back to the people i love oh and this fufu joint  <U+653C><U+3E64><U+613C><U+3E30><U+623C><U+3E64><U+653C><U+3E64><U+623C><U+3E38><U+393C><U+3E63> ,joy,neutral,,,,,,,,,,,,
912, some gh niggas gon be like i lost ma mom and pops and also grew up with dumsor such a struggle i had growing up<U+653C><U+3E64><U+613C><U+3E30><U+623C><U+3E64><U+653C><U+3E64><U+623C><U+3E38><U+383C><U+3E32><U+653C><U+3E64><U+613C><U+3E30><U+623C><U+3E64><U+653C><U+3E64><U+623C><U+3E38><U+383C><U+3E32><U+653C><U+3E64><U+613C><U+3E30><U+623C><U+3E64><U+653C><U+3E64><U+623C><U+3E38><U+383C><U+3E32>,joy,neutral,,,,,,,,,,,,
936, are dey writin de wassce in dumsor de kind of nation we r buildin   dnt care ,joy,neutral,,,,,,,,,,,,
941,are they writing the wassce in dumsor the kind of nation we are building,joy,neutral,,,,,,,,,,,,
1285,question will nana addo dozing off on live radio not even tv put food on my table fix dumsor fix all corrupt ,joy,neutral,,,,,,,,,,,,
1325,the npp is always taking solace in a volatile situation that happened around dumsor amp economic difficulties juxtaposing with our situation,joy,neutral,,,,,,,,,,,,
